{
  "artifacts": [
    {
      "kind": "go-source-file",
      "path": "api/api.go"
    },
    {
      "kind": "go-source-file",
      "path": "cmd/app/main.go"
    },
    {
      "kind": "go-test-file",
      "path": "api/api_test.go"
    }
  ],
  "behavior_paths": [
    {
      "id": "BP-SAVE"
    },
    {
      "id": "BP-STREAM"
    }
  ],
  "contracts": [
    {
      "kind": "type",
      "name": "Record",
      "visibility": "exported"
    },
    {
      "kind": "type",
      "name": "Store",
      "visibility": "exported"
    },
    {
      "kind": "type",
      "name": "Service",
      "visibility": "exported"
    },
    {
      "kind": "sentinel-error",
      "name": "ErrClosed",
      "visibility": "exported"
    }
  ],
  "delegated_differences": [],
  "fixed_decisions": [],
  "output_sha256": "5344a1fe1f9e32cc4b46890bb1dd21327aa84aaa929f6f039667d6cad4bf5a82",
  "ownership": [
    {
      "kind": "service-state",
      "owner": "example.com/bbk/api.Service"
    },
    {
      "kind": "stream",
      "owner": "api.Stream invocation"
    }
  ],
  "preflight_sha256": null,
  "root": "fixtures/go-workspace",
  "schema": "bbk.go.actual-structure-inventory.v1",
  "unsupported_or_uncertain": []
}
